{
  "$schema": "http://json-schema.org/draft-04/schema#",
  "type": "object",
  "properties": {
    "rate": {
      "type": "number",
      "description": "Exchange rate value."
    },
    "source": {
      "type": "string",
      "description": "Source(send) currency code"
    },
    "target": {
      "type": "string",
      "description": "Target(receive) currency code"
    },
    "time": {
      "type": "string",
      "format": "date",
      "description": "Timestamp for exchange rate."
    }
  }
}
